page_content,metadata
优雅的雪茄形外观和古典内饰，依然保留着浓郁的英国绅士风。,"{""brand"": '名爵', ""model"": ""MG7"", ""year"": ""2010款 1.8T 自动加长舒适版"",""price"":""21.48万"",""rating"":""优点""}"
上海汽车南京工厂糟糕的钣金工艺和部分配件质量，导致前保险杠接缝大，小毛病不少。,"{""brand"": '名爵', ""model"": ""MG7"", ""year"": ""2010款 1.8T 自动加长舒适版"",""price"":""21.48万"",""rating"":""缺点""}"
很优雅拉风，不输豪车，很有品位和面子。,"{""brand"": '名爵', ""model"": ""MG7"", ""year"": ""2010款 1.8T 自动加长舒适版"",""price"":""21.48万"",""rating"":""外观""}"
动力不错，油门感应非常灵敏，提速有推背感非常好,"{""brand"": '名爵', ""model"": ""MG7"", ""year"": ""2010款 1.8T 自动精英版"",""price"":""18.78万"",""rating"":""优点""}"
内饰风格可以改进一下，虽然有英国风格，但是年轻人就不是那么给力了,"{""brand"": '名爵', ""model"": ""MG7"", ""year"": ""2010款 1.8T 自动精英版"",""price"":""18.78万"",""rating"":""缺点""}"
外观非常好看大气，很有英国气质，稳重大方。,"{""brand"": '名爵', ""model"": ""MG7"", ""year"": ""2010款 1.8T 自动精英版"",""price"":""18.78万"",""rating"":""外观""}"
用料实在，看着就皮实。,"{""brand"": '名爵', ""model"": ""MG7"", ""year"": ""2010款 1.8T 自动舒适版"",""price"":""16.88万"",""rating"":""优点""}"
上汽、南汽看来已经放弃了对7系的进一步探索，完全没有像解决7系上多个“顽症”的意思啊。小毛病不断啊！,"{""brand"": '名爵', ""model"": ""MG7"", ""year"": ""2010款 1.8T 自动舒适版"",""price"":""16.88万"",""rating"":""缺点""}"
依旧是延续英国时期的设计，最看好的一点，设计复古，钢板，轮胎用料都很实在的说。,"{""brand"": '名爵', ""model"": ""MG7"", ""year"": ""2010款 1.8T 自动舒适版"",""price"":""16.88万"",""rating"":""外观""}"
外观，复古英伦范儿。,"{""brand"": '名爵', ""model"": ""MG7"", ""year"": ""2010款 1.8T 自动舒适版"",""price"":""16.88万"",""rating"":""优点""}"
没有,"{""brand"": '名爵', ""model"": ""MG7"", ""year"": ""2010款 1.8T 自动舒适版"",""price"":""16.88万"",""rating"":""缺点""}"
就是应为这个外观才买这个车。,"{""brand"": '名爵', ""model"": ""MG7"", ""year"": ""2010款 1.8T 自动舒适版"",""price"":""16.88万"",""rating"":""外观""}"
卖mg7最大大一个原因是因为在09年4月份购入了mg3SW，通过一年多的使用，觉得名爵的车车外观很漂亮，十分的原汁原味的英伦范，而且底盘开起来给人的感觉是很整的那种，让人十分满意。,"{""brand"": '名爵', ""model"": ""MG7"", ""year"": ""2010款 1.8T 自动舒适版"",""price"":""16.88万"",""rating"":""优点""}"
上汽收购了南汽过后没有把这款经典的车型继续改进下去，十分失望啊.........,"{""brand"": '名爵', ""model"": ""MG7"", ""year"": ""2010款 1.8T 自动舒适版"",""price"":""16.88万"",""rating"":""缺点""}"
外观就是见仁见智的了，小七的外观很有性格，喜欢的和不喜欢的应该都是极端的吧。,"{""brand"": '名爵', ""model"": ""MG7"", ""year"": ""2010款 1.8T 自动舒适版"",""price"":""16.88万"",""rating"":""外观""}"
外形复古，底盘扎实,"{""brand"": '名爵', ""model"": ""MG7"", ""year"": ""2010款 1.8T 自动精英版"",""price"":""18.78万"",""rating"":""优点""}"
小毛病多，塑料件脆弱。下底板的塑料件螺丝孔都豁了无语啊,"{""brand"": '名爵', ""model"": ""MG7"", ""year"": ""2010款 1.8T 自动精英版"",""price"":""18.78万"",""rating"":""缺点""}"
经典雪茄外形我喜欢,"{""brand"": '名爵', ""model"": ""MG7"", ""year"": ""2010款 1.8T 自动精英版"",""price"":""18.78万"",""rating"":""外观""}"
动力足，油耗低，用料足，外观耐看，有个性,"{""brand"": '名爵', ""model"": ""MG7"", ""year"": ""2010款 1.8T 自动精英版"",""price"":""18.78万"",""rating"":""优点""}"
底盘低，通过性不是很好,"{""brand"": '名爵', ""model"": ""MG7"", ""year"": ""2010款 1.8T 自动精英版"",""price"":""18.78万"",""rating"":""缺点""}"
耐看,"{""brand"": '名爵', ""model"": ""MG7"", ""year"": ""2010款 1.8T 自动精英版"",""price"":""18.78万"",""rating"":""外观""}"
动力还算好。,"{""brand"": '名爵', ""model"": ""MG7"", ""year"": ""2010款 1.8T 自动加长豪华版"",""price"":""24.88万"",""rating"":""优点""}"
保有量太低，不好修。,"{""brand"": '名爵', ""model"": ""MG7"", ""year"": ""2010款 1.8T 自动加长豪华版"",""price"":""24.88万"",""rating"":""缺点""}"
线条优雅，大灯我喜欢,"{""brand"": '名爵', ""model"": ""MG7"", ""year"": ""2010款 1.8T 自动加长豪华版"",""price"":""24.88万"",""rating"":""外观""}"
外观独特优雅，内饰沉稳有内涵，用料厚道，底盘厚重，高速超级无敌稳，遇到颠簸路面时所表现沉稳厚实，悬挂特别有任性，刹车脚感很线性，有三五十万车子的感觉。,"{""brand"": '名爵', ""model"": ""MG7"", ""year"": ""2010款 1.8T 自动舒适版"",""price"":""16.88万"",""rating"":""优点""}"
内饰工艺不精，发动机声音偏响，动力稍肉，油耗较高，转向较为笨重。,"{""brand"": '名爵', ""model"": ""MG7"", ""year"": ""2010款 1.8T 自动舒适版"",""price"":""16.88万"",""rating"":""缺点""}"
太喜欢了,"{""brand"": '名爵', ""model"": ""MG7"", ""year"": ""2010款 1.8T 自动舒适版"",""price"":""16.88万"",""rating"":""外观""}"
最满意当然要说空间了，轴距直接加长20cm，达到2949mm，超越老款A6L的轴距，后排腿部空间同级无敌，单论后排感觉比老款A6L大。,"{""brand"": '名爵', ""model"": ""MG7"", ""year"": ""2010款 1.8T 自动加长舒适版"",""price"":""21.48万"",""rating"":""优点""}"
最不满意的是那复古的仪表盘，看起来像老爷车，不过也有人喜欢，说这是典型的英伦风格。,"{""brand"": '名爵', ""model"": ""MG7"", ""year"": ""2010款 1.8T 自动加长舒适版"",""price"":""21.48万"",""rating"":""缺点""}"
这个见仁见智了，我觉得这外观很有韵味，典型的英伦风格，唯独让我不满意的是尾部收的太厉害，正后方看这车会感觉窄。,"{""brand"": '名爵', ""model"": ""MG7"", ""year"": ""2010款 1.8T 自动加长舒适版"",""price"":""21.48万"",""rating"":""外观""}"
如果说奔驰是老虎，宝马是骏马，奥迪的科幻，那小七就是千年不变的豹子，这身材长的面条，俩只犀利的眼睛，回缩的小屁股，加上超低的地盘，在夕阳渐下的夕阳下一闪而过。美轮美奂。,"{""brand"": '名爵', ""model"": ""MG7"", ""year"": ""2010款 1.8T 自动豪华版"",""price"":""20.28万"",""rating"":""外观""}"
发动机与变速箱匹配的好，没有什么顿挫感。方向盘力度轻盈，容易上手，女士开也没有问题。大众品牌保值率高，朗逸虽是启航版，开起来也不错，性价比之选。地盘很扎实，整体性很强，虽然有点路噪和风噪，但是都在可接受范围之内，毕竟价格不高。,"{""brand"": '大众', ""model"": ""朗逸"", ""year"": ""2019款 朗逸启航 1.5L 自动风尚版 国VI"",""price"":""11.29万"",""rating"":""优点""}"
配置太低，没有雾灯，大灯全是卤素的，低配是15寸轮毂，相交18款简配了中央扶手。,"{""brand"": '大众', ""model"": ""朗逸"", ""year"": ""2019款 朗逸启航 1.5L 自动风尚版 国VI"",""price"":""11.29万"",""rating"":""缺点""}"
老套的设计，没什么新鲜感。大众的外观感觉都差不多，没仔细瞅过。,"{""brand"": '大众', ""model"": ""朗逸"", ""year"": ""2019款 朗逸启航 1.5L 自动风尚版 国VI"",""price"":""11.29万"",""rating"":""外观""}"
让我最满意的地方就是外观，车身的设计很动感，线条也流畅，在这个级别车型里让我感觉最有眼缘，特别是前脸的中网大气耐看，很大众，整个外观看过去还是比较顺眼的。,"{""brand"": '大众', ""model"": ""朗逸"", ""year"": ""2019款 朗逸启航 1.5L 自动风尚版 国VI"",""price"":""11.29万"",""rating"":""优点""}"
整体来说都还是不错的，细节部分如果能注意一下会更加完美，悬架调校偏硬，遇到颠簸路段或者长时间乘坐就没那么舒服。另外吐槽一下内饰的设计上有点中规中矩，没有外表那么动感时尚。,"{""brand"": '大众', ""model"": ""朗逸"", ""year"": ""2019款 朗逸启航 1.5L 自动风尚版 国VI"",""price"":""11.29万"",""rating"":""缺点""}"
我是有点颜值控，对于外观特别注重，这个车外观显得动感又很时尚，车身线条挺流畅的，质感挺不错的。特别是车灯的造型也很好看，夜间点亮效果不错！我觉得还是挺适合刚出来打拼的年轻人开的。,"{""brand"": '大众', ""model"": ""朗逸"", ""year"": ""2019款 朗逸启航 1.5L 自动风尚版 国VI"",""price"":""11.29万"",""rating"":""外观""}"
满意的第一点就是他的车价格便宜。我的经济预算不多，所以都想花最少的钱买最好的车。看车的时候很多车子的价格超出预算的都不能买。付和我预算的车型就那么几个。花10万块钱买一个轿车还是合资车，也是大众的车，品牌也不错，整体我是非常满意的。第二个就是他的空间很大。因为我选择对于空间也有需求，可能考虑到后期结婚呢回家。各方面用车需求比较多。空间也是我考虑的一点。级别车型中朗逸的空间还是非常大的。是满足了我的需求。第三个就是他的外观非常年轻运动。外观看起来一点也不老气。符合我们现在的气质。车身的做工以及车漆都没有特别值得称赞的点。毕竟价位在这儿能有这个效果，我已经是非常满意了。,"{""brand"": '大众', ""model"": ""朗逸"", ""year"": ""2019款 朗逸启航 1.5L 自动舒适版 国VI"",""price"":""12.39万"",""rating"":""优点""}"
没有什么不满意的，各方面都很满意，价格便宜。,"{""brand"": '大众', ""model"": ""朗逸"", ""year"": ""2019款 朗逸启航 1.5L 自动舒适版 国VI"",""price"":""12.39万"",""rating"":""缺点""}"
款车子的外观看起来一点也不老气。年轻人也能拿捏得下来。他的很多细节方面处理的很到位，虽然车漆没有经过特殊的处理，也不是特别靓丽。价位不高吗，咱们也不能有太多的要求。虽然没有什么特殊的技术含量在里面，但是整体的车漆很厚，皮很结实。,"{""brand"": '大众', ""model"": ""朗逸"", ""year"": ""2019款 朗逸启航 1.5L 自动舒适版 国VI"",""price"":""12.39万"",""rating"":""外观""}"
现在三千多公里的磨合。大致也有这么几个点吧。首先肯定是价格。这款车子落地12万。大礼包和保养。都有免费赠送。这个价格买一款合资车大品牌的我非常满意。第二个就是这款车子带来的使用价值。车子的空间挺大，能够满足我们一家三口的使用。第三个就是外观。车子本身虽然不贵，但是他却没有那种可以直视的廉价感。车漆的做工以及钣金的厚度都不错。在小路上跑也比较上档次。,"{""brand"": '大众', ""model"": ""朗逸"", ""year"": ""2019款 朗逸启航 1.5L 自动舒适版 国VI"",""price"":""12.39万"",""rating"":""优点""}"
我是10月份买的车，现在两个多月了。开那三千多公里，各方面感受都挺良好，其中不满意的点有两个，第一个。由于价位不是很高，可能它的舒适性在同级别车型中要稍微差一点。在路上跑起来的噪音也挺大的。第二个就是它的内饰设计的有点简约，我去丈母娘家的时候，说你这个车里面怎么这么丑。,"{""brand"": '大众', ""model"": ""朗逸"", ""year"": ""2019款 朗逸启航 1.5L 自动舒适版 国VI"",""price"":""12.39万"",""rating"":""缺点""}"
车子的外观非常的存在，看起来年轻运动跟我这个90后的很搭配，路上跑起来感觉不老气，而且还有一定的回头率。,"{""brand"": '大众', ""model"": ""朗逸"", ""year"": ""2019款 朗逸启航 1.5L 自动舒适版 国VI"",""price"":""12.39万"",""rating"":""外观""}"
考虑买车就是冲着空间，实用，省油，这些要求去选的，所以，对于朗逸这款车最满意的首先是空间足够大，不管是乘坐还是后备箱装东西，都相当宽敞，还有就是1.5L的发动机，家用车黄金排量，工薪阶层能够承受的油耗，还有应该就是大众这个品牌吧，给我们这些消费大众的信心。,"{""brand"": '大众', ""model"": ""朗逸"", ""year"": ""2019款 朗逸启航 1.5L 自动风尚版 国VI"",""price"":""11.29万"",""rating"":""优点""}"
说到不满意，应该就是内饰稍微偏土气了一些，还有也就是来源于排量动力，既然是家用，要省油，那肯定就不能要求太高，动力会弱一些也是正常，我就是有些后悔了，应该买个又省油又动力强的，比如带涡轮增压的发动机，应该会比这个1.5L的好一些，当然这只是小遗憾，并未给我带来实质的不满意。,"{""brand"": '大众', ""model"": ""朗逸"", ""year"": ""2019款 朗逸启航 1.5L 自动风尚版 国VI"",""price"":""11.29万"",""rating"":""缺点""}"
外形我家人都觉得不错，大大方方的，尤其大灯设计，不奇怪，有时候在路上开车总能看到有些品牌的车那大灯设计造型老怪异了，朗逸还行，整个车身设计也看起来比较显大，,"{""brand"": '大众', ""model"": ""朗逸"", ""year"": ""2019款 朗逸启航 1.5L 自动风尚版 国VI"",""price"":""11.29万"",""rating"":""外观""}"
新一代卡罗拉总算是不再油腻了，之前的充满了油腻感。整体线条感很好，前脸和凯美瑞很像。也算上是家族式设计。,"{""brand"": '丰田', ""model"": ""卡罗拉"", ""year"": ""2021款 1.2T S-CVT精英PLUS版"",""price"":""12.88万"",""rating"":""外观""}"
最满意的就是启航的性价比了，买这个车的人应该都会考虑这一点，算是这个价位自动挡家用代步车里面性价比高的。对于女司机来说，启航朗逸的发动机和变速箱匹配的也很好，开起来比较顺畅没有顿挫感。作为我们小家庭的第一辆车，还是比较满意的，性价比在线。,"{""brand"": '大众', ""model"": ""朗逸"", ""year"": ""2019款 朗逸启航 1.5L 自动风尚版 国VI"",""price"":""11.29万"",""rating"":""优点""}"
最不满意后备箱的开启方式，要用钥匙才能开启，后备箱不带开启按钮。对于我们这种有孩子的家庭很不方便，抱着孩子开后备箱很麻烦，配置还是略低了一点。,"{""brand"": '大众', ""model"": ""朗逸"", ""year"": ""2019款 朗逸启航 1.5L 自动风尚版 国VI"",""price"":""11.29万"",""rating"":""缺点""}"
外观中规中矩吧，一看就是大众车。整体外观平平，没啥特别之处，只能安慰自己越简单越耐看，毕竟价格在那，也不能有太高的要求。,"{""brand"": '大众', ""model"": ""朗逸"", ""year"": ""2019款 朗逸启航 1.5L 自动风尚版 国VI"",""price"":""11.29万"",""rating"":""外观""}"
丰田车最满意的相信车友们都会知道.皮实耐用和低油耗已经并不新鲜了，经过一个月的驾驶，还有好多让我更满意的地方！推背感还是不错的！相比老款动力提升了不少，同级别其他品牌的话就不用说了，点赞！良心丰田，卡罗拉！,"{""brand"": '丰田', ""model"": ""卡罗拉"", ""year"": ""2021款 TNGA 1.5L CVT精英CARE版"",""price"":""13.28万"",""rating"":""优点""}"
非要说最不满意的话，车的品质是无可挑剔的，价格偏高，但是可以承受！最主要是1.5卡罗拉的活动不是太多，期待厂家或车商组织一些更好的活动，把车友们组织起来！,"{""brand"": '丰田', ""model"": ""卡罗拉"", ""year"": ""2021款 TNGA 1.5L CVT精英CARE版"",""price"":""13.28万"",""rating"":""缺点""}"
外观的流线型大体延续以往的风格 很不错！一些细节还是做的不错的。还是期待外观有更大改进！,"{""brand"": '丰田', ""model"": ""卡罗拉"", ""year"": ""2021款 TNGA 1.5L CVT精英CARE版"",""price"":""13.28万"",""rating"":""外观""}"
"最满意的还主要是这个车的价格吧,因为当时手里的钱也不是很多，这笔资金说多不多，但对我来说也不是一笔小数目，肯定要慎重考虑。方向盘的手感比较轻，上手比较容易。不管是男人还是女人，操控起来都是比较轻松的。颜值高，油耗也省，一个月一箱油是足够的，现在出门方便多了。","{""brand"": '大众', ""model"": ""朗逸"", ""year"": ""2019款 朗逸启航 1.5L 自动风尚版 国VI"",""price"":""11.29万"",""rating"":""优点""}"
车启动有噪音，但是声音不算太难听，影响不是太大。外观这么好看的一个车，内饰就稍微有一点让人失望的感觉了，设计风格实在是有点老土的，没什么亮点，不够时尚。有点太简单了，有时候路感不好，导致的舒适感不那么好。,"{""brand"": '大众', ""model"": ""朗逸"", ""year"": ""2019款 朗逸启航 1.5L 自动风尚版 国VI"",""price"":""11.29万"",""rating"":""缺点""}"
朗逸这辆车看着非常的喜欢，这个车整体简洁大方，车身线条也很流畅，整体造型精致，设计感十足，是我喜欢的那种风格，车灯的高度我觉得比较舒服，晚上跑高速也不散光，可视距离比较可观。,"{""brand"": '大众', ""model"": ""朗逸"", ""year"": ""2019款 朗逸启航 1.5L 自动风尚版 国VI"",""price"":""11.29万"",""rating"":""外观""}"
混迹之家十年有余，几乎看完和了解了所有常见的车，这个车也是家里第三辆车了（第一辆二手车），但我第一次写提车作业，写的不好的地方请大家见谅。最满意的是这个车便宜，空间大，省油，驾驶操控很好，行驶质感不错，大众车高级（梗来的）。,"{""brand"": '大众', ""model"": ""朗逸"", ""year"": ""2019款 朗逸启航 1.5L 手动风尚版 国VI"",""price"":""10.09万"",""rating"":""优点""}"
配置低，好多东西需要后期加装，不过还好在某宝上买了十一个快递，不到两千块解决。,"{""brand"": '大众', ""model"": ""朗逸"", ""year"": ""2019款 朗逸启航 1.5L 手动风尚版 国VI"",""price"":""10.09万"",""rating"":""缺点""}"
外观深得我心，虽然是旧款，但经典耐看，话说大众车外观都差不多，哈哈。买的白色，显得大气，感觉比新款还好看（酸葡萄了，哈哈）。开几年应该不会觉得过时。,"{""brand"": '大众', ""model"": ""朗逸"", ""year"": ""2019款 朗逸启航 1.5L 手动风尚版 国VI"",""price"":""10.09万"",""rating"":""外观""}"
买给老婆的结婚礼物，一辆几万块的车因为是手动挡，有一百多匹马力开出了自吸车自动挡20万的动力感觉，有什么不好，呵呵。当然，前提是我自己开了好些年车了，对于手动车型有一些了解，经常利用手动挡降档超车，所以如果不是涡轮车，十几万的自动挡车型恐怕很难在城市道路和山路和它跑跑哦。,"{""brand"": '大众', ""model"": ""朗逸"", ""year"": ""2019款 朗逸启航 1.5L 手动风尚版 国VI"",""price"":""10.09万"",""rating"":""优点""}"
这是我老婆的第一辆车，我绝对不会说它有什么明显的缺点，就是本来想要银色的，可惜时间紧，他们四S店基本都是白色的，如果颜色多一点选择就好了，白色的车现在实在太多了。不过也问题不大，老婆喜欢就好。,"{""brand"": '大众', ""model"": ""朗逸"", ""year"": ""2019款 朗逸启航 1.5L 手动风尚版 国VI"",""price"":""10.09万"",""rating"":""缺点""}"
这辆车虽然是大众的低端车型，但是我觉得外观设计上一点都没有给人廉价的感觉，前脸，侧脸的设计感都挺稳重，大气的。也适合我们这些三十几的人，让我现在开思域这样的设计的车我是真接受不了了。所以我这点是很满意的，用的油漆也是挺良心的，刮到过一次，但是仔细看它的漆面还是用料很足，很厚，自己表妹的车致炫当时看它刮到后漆就很薄。这点是不错的。,"{""brand"": '大众', ""model"": ""朗逸"", ""year"": ""2019款 朗逸启航 1.5L 手动风尚版 国VI"",""price"":""10.09万"",""rating"":""外观""}"
其实家庭用车没有什么特别，就是一款很大众的车，有口碑有销量，所以自然而然的就选择了他，如果非要说最满意的，那就是空间和油耗，我们家的人都是比较高又相对有点胖，前排和后排都坐上人，也没有拥挤的感觉。这个车我自己上下班用，一天两趟从家到公司，距离17公里左右，一月一箱油。,"{""brand"": '大众', ""model"": ""朗逸"", ""year"": ""2019款 朗逸启航 1.5L 自动风尚版 国VI"",""price"":""11.29万"",""rating"":""优点""}"
最不满意的就是后备箱的开启方式，太麻烦，只能用钥匙或者是主驾驶门上那个开关，有时候钥匙在车上，走到车尾还得折回来去搬一下开关，用车一个月果断安装了个感应后备箱。,"{""brand"": '大众', ""model"": ""朗逸"", ""year"": ""2019款 朗逸启航 1.5L 自动风尚版 国VI"",""price"":""11.29万"",""rating"":""缺点""}"
怎么说呢，非常大众，基本没有什么特点，但是就是因为大众所以比较耐看。前脸真是大众传统血统，网友喷像套娃一样，一点没错。大灯还是卤素大灯，考虑是不是要换个LED的。,"{""brand"": '大众', ""model"": ""朗逸"", ""year"": ""2019款 朗逸启航 1.5L 自动风尚版 国VI"",""price"":""11.29万"",""rating"":""外观""}"
满意的那太多了 排气这一代有很大提升 15段阻尼可调节 HUD抬头显示 哈曼卡顿音响 原地增压弹射起步 L2级别的自动驾驶 虽说这车要这个没有用 但是不能没有 之前跑高速600公里 全程盯着跑 太累 总之 用不用是我的事 但是不能没有 15段阻尼可调 舒适模式仿佛坐船 基本的小动作都过滤掉了 车提回来跑过几次山 运动模式支撑很有信心！ 增压弹射起步真的很有用 原厂增压弹射6.4秒 稍微换个胎 感觉还能再快个0.几 因为原厂的胎太滑了。 渐进式的转向 手感太棒了 换了这车之后从来没有cuo过方向盘 因为基本除了掉头 需要打死 其他情况都是两手握方向盘 转弯到一半 踩油门 右手拨片升档 然后只听后面 啪啪啪…… 接下来说这个启动咆哮 回头率真的高 一般人多的时候 或者旁边有人的时候我都不敢启动 怕吓他们哈哈 声音真的很大 很燃 很爆💥。收油回火的声音很容易踩出来 3000转到4000转之间 一脚油门 立刻松开 只听后面 啪啪啪 三声炮声 太美妙。最后说说桶椅 包裹性真的很强 感觉劈弯的时候丝毫不跑 稳坐如钟 还有就是 太帅啦吧哈哈😆最后说一下珠光白这个颜色 第一开始本来大爱黑色 但是整个石家庄4S就到了一辆车 我心想去看看吧 结果一眼就拔不出来了 珠光白真的太有气质了 随说可能没有猛士黑那么凶狠 白色略显秀气 但又不失凶猛 阳光下特别通透 亮度很高 所以 直接交钱 订车！ 因为不想等预售 提前开走也是大费周折 4S店也很不错 👍 4S一个经理也是高7车主 送我了很多东西，还没有收服务费乱七八糟的 太感谢🙏。,"{""brand"": '大众', ""model"": ""高尔夫"", ""year"": ""2021款 380TSI DSG GTI"",""price"":""22.98万"",""rating"":""优点""}"
要说不满意 只能说4代EA888没有进来 但是 鱼和熊掌怎么能兼得呢 4代888进来估计得等到23年了。还是早买早享受吧 毕竟 程序一大堆 随便刷个1阶 怒增60匹没啥问题 没有原装19寸轮毂挺可惜的 不过 谁买这车不改呢？是吧。,"{""brand"": '大众', ""model"": ""高尔夫"", ""year"": ""2021款 380TSI DSG GTI"",""price"":""22.98万"",""rating"":""缺点""}"
感觉没有7.5代的凶呢？ 轮毂更夸张了 灯更好看了 尾吼更大了 开开前雾灯很漂亮 辨识度很高,"{""brand"": '大众', ""model"": ""高尔夫"", ""year"": ""2021款 380TSI DSG GTI"",""price"":""22.98万"",""rating"":""外观""}"
我买的这款1.5L手动风尚作为一款10万以内的家用轿车说到最满意的地方就是它的外观和操控了，在外观方面朗逸启航和上一代朗逸比较相似，车身修长前脸比较圆润贯穿式的进去格栅和大灯相连相连在了一起属于一个大众家族式的设计很有辨识度的离远就可以认出是一台大众车，同时搭配着15寸的轮毂让车子看起来也更稳重一些。其次就是操控在车子的整体驾驶中所给我感受就是车子的稳定性不错，不用担心跑高速或者路况较差的道路时车子不稳当或者发飘的情况，其次呢转向系统操控起来比较灵活不笨重，平时出行的时候开着油门刹车反响应也都比较快。,"{""brand"": '大众', ""model"": ""朗逸"", ""year"": ""2019款 朗逸启航 1.5L 手动风尚版 国VI"",""price"":""10.09万"",""rating"":""优点""}"
